<?xml version="1.0" encoding="UTF-8"?>

<!ELEMENT enumeration (name,type,enums)>
<!ELEMENT name (#PCDATA)>
<!ELEMENT type (#PCDATA)>

<!ELEMENT enums (enum+)>

<!ELEMENT enum (name,value?)>
<!ELEMENT value (#PCDATA)>